{"run":18,"commit":"05f188e","metric":6538,"metrics":{"full_players":41,"hero_players":0,"spawn_players":54,"profile_players":54,"active_players":53,"prop_counter_players":42,"talent_players":41,"interaction_players":25,"scalar_players":42,"extended_players":42,"event_kinds":10,"matches_with_mode":9,"total_players":54},"status":"keep","description":"Inferred ARAL talent-like offer and choice IDs from early self-targeted opcode-1087 family 0xbc bursts, adding per-player loadout-style state and a new timeline category.","timestamp":1776522428209,"segment":1,"confidence":17.05263157894737,"iterationTokens":2632,"asi":{"hypothesis":"Early self-targeted 1087 family 0xbc bursts encode ARAL talent/loadout setup; the initial high-valued entries look like offered options and the later distinct value looks like the selected choice.","learning":"This heuristic recovers talent-like choice IDs for 41 players and fits the ARAL-only context well. Some players show 1-3 early offer IDs followed by a later distinct chosen ID, matching the game's talent selection flow.","artifact":"Player.talent_offer_ids and Player.talent_choice_id now derived from self-target 1087 family 0xbc sequences, gated to ARAL modes.","next_action_hint":"Correlate talent_choice_id clusters with later scalar/stat families and hero-target interaction families to identify talent-induced cooldown/stat modifications versus base hero behavior."}}
{"run":19,"commit":"2a910db","metric":6810,"metrics":{"full_players":41,"hero_players":0,"spawn_players":54,"profile_players":54,"active_players":53,"prop_counter_players":42,"talent_players":41,"ability_players":16,"farm_players":18,"interaction_players":25,"scalar_players":42,"extended_players":42,"event_kinds":10,"matches_with_mode":9,"total_players":54},"status":"keep","description":"Tracked per-player hero-target and minion-target 1087 interaction families, turning tentative combat-cast and farm participation into reusable player-state fields.","timestamp":1776522501786,"segment":1,"confidence":15.948717948717949,"iterationTokens":3632,"asi":{"hypothesis":"Once 1087 interactions are split by target class, the source player should expose persistent ability-like and farm-like participation families that are useful beyond one-off events.","learning":"Hero-target and 2000-2099-target interaction families are stable enough to retain directly on the player model, giving reusable ability-participation and farm-participation signals.","artifact":"Player.hero_interaction_families and Player.minion_interaction_families now accumulate 1087 family bytes by target class; evaluator tracks ability_players and farm_players.","next_action_hint":"Use talent_choice_id × hero_interaction_families × scalar/prop families to isolate talent-modified abilities, cooldown-related self-state, or farm reward channels."}}
{"run":20,"commit":"8260f7c","metric":6954,"metrics":{"full_players":41,"hero_players":0,"spawn_players":54,"profile_players":54,"active_players":53,"prop_counter_players":42,"talent_players":41,"ability_players":16,"farm_players":18,"farm_reward_players":18,"interaction_players":25,"scalar_players":42,"extended_players":42,"event_kinds":10,"matches_with_mode":9,"total_players":54},"status":"keep","description":"Inferred recurring post-minion opcode-1086 reward families per player, turning minion-target interactions into reusable farm-reward channels.","timestamp":1776522778843,"segment":1,"confidence":7.191709844559585,"iterationTokens":4855,"asi":{"hypothesis":"If minion-target 1087 interactions really represent farm/last-hit activity, the same source player should repeatedly receive a small set of 1086 counter-family updates immediately afterward.","learning":"This pattern is strong enough to recover stable farm-reward channel types per player. In multiple matches the same 1086 families recur after 2000-2099 interaction windows, which supports the farm-reward interpretation.","artifact":"New detect_farm_reward_channels() helper populates Player.farm_reward_types from recurring post-minion 1086 pulses.","next_action_hint":"Differentiate which farm_reward_types are likely gold versus XP by comparing co-occurrence with existing 0x3e/0x4d aliases and by checking whether one family appears without the other on shared-lane interactions."}}
{"run":21,"commit":"28de0da","metric":7020,"metrics":{"full_players":41,"hero_players":0,"spawn_players":54,"profile_players":54,"active_players":53,"prop_counter_players":42,"talent_players":41,"ability_players":16,"cooldown_players":6,"farm_players":18,"farm_reward_players":18,"interaction_players":25,"scalar_players":42,"extended_players":42,"event_kinds":11,"matches_with_mode":9,"total_players":54},"status":"keep","description":"Recovered recurring self-state followup channels after hero-target interactions, adding tentative cooldown-like 1052/1087 channels for players with repeatable post-cast self updates.","timestamp":1776522885795,"segment":1,"confidence":4.720779220779221,"iterationTokens":5927,"asi":{"hypothesis":"Real ability activations should be followed by recurring self-state updates on the source player; repeated post-interaction 1052 or self-target 1087 channels are good cooldown-like candidates.","learning":"A small but real subset of players shows repeatable post-cast self channels, strong enough to retain as tentative cooldown/ability-side state rather than one-off noise.","artifact":"Player.ability_followup_scalar_types and Player.ability_followup_prop_families now capture recurring post-hero-interaction self channels; cooldown-like events are emitted once per player.","next_action_hint":"Cross-tab cooldown-like channels against talent_choice_id and hero_interaction_families to split base ability patterns from talent-modified ones, then revisit hero identity mapping using these richer fingerprints."}}
{"run":22,"commit":"756f91f","metric":7104,"metrics":{"full_players":41,"hero_players":0,"spawn_players":54,"profile_players":54,"active_players":53,"prop_counter_players":42,"talent_players":41,"ability_players":16,"cooldown_players":6,"farm_players":18,"farm_reward_players":18,"interaction_players":25,"scalar_players":42,"extended_players":42,"event_kinds":13,"matches_with_mode":9,"total_players":54},"status":"keep","description":"Added per-event xp-like and gold-like gain attribution around minion and death windows using recurring 1086 0x3e/0x4d counter deltas.","timestamp":1776523244704,"segment":1,"confidence":4.632530120481928,"iterationTokens":22682,"asi":{"hypothesis":"The two best-behaved 1086 counter families can be attributed more concretely by looking at their deltas inside farm and death reward windows, yielding replay-usable xp-like and gold-like event annotations.","learning":"0x3e and 0x4d now behave well enough to drive per-event xp-like and gold-like gain annotations around minion windows and kill/assist windows without requiring exact final semantics yet.","artifact":"New detect_resource_gain_events() helper emits farm xp-like/gold-like gains and kill-window / assist-window xp-like/gold-like gains from 1086 delta tracking.","next_action_hint":"Use the emitted xp-like gain stream plus base-stat jump clusters to infer level-up thresholds or at least level-like milestone events, then wire the richer timeline into the dashboard API path."}}
{"run":23,"commit":"9cb1881","metric":7398,"metrics":{"full_players":41,"hero_players":0,"spawn_players":54,"profile_players":54,"active_players":53,"prop_counter_players":42,"talent_players":41,"ability_players":16,"cooldown_players":6,"farm_players":18,"farm_reward_players":18,"xp_gain_players":18,"gold_gain_players":18,"kill_gain_players":1,"assist_gain_players":0,"interaction_players":25,"scalar_players":42,"extended_players":42,"event_kinds":13,"matches_with_mode":9,"total_players":54},"status":"keep","description":"Tracked per-player xp-like and gold-like gain evidence from farm and kill windows, turning resource attribution into reusable player-state for the replay timeline.","timestamp":1776523349232,"segment":1,"confidence":5.146067415730337,"iterationTokens":5454,"asi":{"hypothesis":"If replay-grade attribution is the goal, resource gain evidence should live both as timeline events and as reusable per-player state, not only as raw events.","learning":"Farm-driven xp-like and gold-like attribution is strong enough to promote to player-level state. Kill-window gain evidence exists but is still sparse, so kill-side attribution remains weaker than farm-side attribution.","artifact":"Player.xp_like_gain_events, Player.gold_like_gain_events, Player.kill_window_gain_events, and Player.assist_window_gain_events now accumulate from detect_resource_gain_events().","next_action_hint":"Use xp_like_gain_events together with activation order and repeated counter milestones to infer level-like progression events, then propagate the enriched timeline into vg_dashboard_server.py so the browser dashboard can replay it."}}
{"run":24,"commit":"e87e3ef","metric":7570,"metrics":{"full_players":41,"hero_players":0,"spawn_players":54,"profile_players":54,"active_players":53,"prop_counter_players":42,"talent_players":41,"ability_players":16,"cooldown_players":6,"farm_players":18,"farm_reward_players":18,"xp_gain_players":18,"gold_gain_players":18,"kill_gain_players":1,"assist_gain_players":0,"level_players":17,"interaction_players":25,"scalar_players":42,"extended_players":42,"event_kinds":14,"matches_with_mode":9,"total_players":54},"status":"keep","description":"Added level-like milestone detection by combining xp-like counter updates with clustered self-stat jumps, yielding approximate progression events for replay timelines.","timestamp":1776523495933,"segment":1,"confidence":3.334442595673877,"iterationTokens":8050,"asi":{"hypothesis":"Even without an explicit decoded level field, xp-like counter increases combined with clustered self-stat jumps should reveal approximate level-up milestones that are useful for replay and further reverse engineering.","learning":"This heuristic recovers level-like milestones for a meaningful subset of players, especially in longer ARAL captures, and matches the intuition that progression should couple xp-like changes with base-stat shifts.","artifact":"Player.level_like_events and Player.estimated_level_like now advance from detect_level_like_milestones(); events are emitted as 'level-like milestone -> approx level N'.","next_action_hint":"Propagate the enriched event timeline and player state into vg_dashboard_server.py / dashboard JSON, then keep refining exact level / kill-reward / item semantics against these replay-friendly annotations."}}
{"run":25,"commit":"56c9e4b","metric":7598,"metrics":{"full_players":41,"hero_players":0,"spawn_players":54,"profile_players":54,"active_players":53,"prop_counter_players":42,"talent_players":41,"ability_players":16,"cooldown_players":6,"farm_players":18,"farm_reward_players":18,"item_players":2,"xp_gain_players":18,"gold_gain_players":18,"kill_gain_players":1,"assist_gain_players":0,"level_players":17,"interaction_players":25,"scalar_players":42,"extended_players":42,"event_kinds":15,"matches_with_mode":9,"total_players":54},"status":"keep","description":"Added conservative item-like loadout detection from later self-targeted 1087 family 0xbc changes, surfacing a first replay-friendly purchase/equip-style category.","timestamp":1776523620452,"segment":1,"confidence":3.1165644171779143,"iterationTokens":5382,"asi":{"hypothesis":"Later self-targeted 1087 family 0xbc values that are distinct from the early talent sequence likely represent item/loadout changes rather than talent offers, and are useful for replay even before exact item names are mapped.","learning":"A small but nonzero subset of players shows later unique 0xbc self-values after the early talent phase, enough to justify a conservative item-like category. Coverage is low, so this remains tentative.","artifact":"Player.item_like_ids now accumulates later self-targeted 1087 family 0xbc values outside the constant/talent set; events are emitted as 'item-like loadout id N'.","next_action_hint":"Cross-check these item-like ids against subsequent stat/cooldown changes to separate real item purchases from other loadout mutations, then start mirroring the enriched timeline through vg_dashboard_server.py for the browser replay."}}
{"type":"config","name":"Full-match Vainglory scoreboard replay decoding","metricName":"scoreboard_score","metricUnit":"","bestDirection":"higher"}
{"run":26,"commit":"49147c2","metric":5504,"metrics":{},"status":"keep","description":"Rebased autoresearch onto full-match scoreboard replay state, filtered resource totals to plausible raw 1086 counters, and surfaced gameplay-focused dashboard fields for level, kills, deaths, CS, gold, and XP.","timestamp":1776525088931,"segment":2,"confidence":null,"iterationTokens":119,"asi":{"hypothesis":"The session had drifted toward generic event labels; resetting the benchmark around replay-usable scoreboard state and treating 1086 0x3e/0x4d as plausible raw totals should create a better baseline and immediately fix the obviously wrong dashboard gold/xp display.","learning":"The new scoreboard-focused baseline scores 7 full gameplay captures / 42 active players. Raw 1086 totals now produce plausible gold/xp magnitudes in the CLI dashboard, while kill attribution remains sparse and is the biggest remaining gameplay gap.","artifact":"New primary metric scoreboard_score=5504 with secondary metrics centered on gold/xp timelines, death coverage, kills, CS, level-ups, and replay-ready players.","next_action_hint":"Improve kill attribution and level/CS confidence by correlating death windows and stat-jump windows with additional 1086 families, especially 0x42 near level-up-like transitions."}}
{"run":27,"commit":"b0cd4ce","metric":5861,"metrics":{},"status":"keep","description":"Added a conservative kill-attribution fallback that uses a single post-death 1086 reward recipient when no direct pre-death combat interaction is available.","timestamp":1776525320562,"segment":2,"confidence":null,"iterationTokens":9724,"asi":{"hypothesis":"Many deaths do not expose a clean pre-death hero-target 1087, but the killer still receives a unique immediate resource reward; using that as a fallback should improve kill counts without drifting back into generic event heuristics.","learning":"This materially improved scoreboard replay coverage: kill_players rose from 4 to 15 and replay_players from 25 to 29, while gold/xp, CS, and level coverage stayed flat.","artifact":"detect_kill_like_interactions() now prefers the latest pre-death hero-target interaction, then falls back to a unique non-victim 0x3e/0x4d reward recipient within 0.5s after death.","next_action_hint":"Apply the same temporal-correlation idea to level and CS: test 1086 family 0x42 against stat-jump / level-up windows, and tighten CS by distinguishing unique last-hit reward windows from repeated minion poke on the same target."}}
{"run":28,"commit":"d2f33f9","metric":6099,"metrics":{},"status":"keep","description":"Widened the 0x3e-to-stat-jump level-up correlation window, recovering more plausible ARAL level milestones without changing gold/xp or kill heuristics.","timestamp":1776525519233,"segment":2,"confidence":2.5,"iterationTokens":6456,"asi":{"hypothesis":"The existing level-up detector was too strict on timing; real level-up stat bursts can spill slightly beyond 0.2s / 40 messages after the 0x3e update, so a modestly wider window should recover missed level milestones without adding obvious noise.","learning":"This improved level coverage materially: level_players rose from 16 to 23 and replay_players from 29 to 33. Sample outputs stayed plausible, with longer ARAL matches now surfacing level 6-7 players rather than leaving them at base level 4.","artifact":"detect_level_like_milestones() now scans 60 subsequent messages and allows a 0.25s stat-jump window after each plausible 0x3e update.","next_action_hint":"Refine CS next: replace the current per-target cooldown heuristic with a stronger last-hit signature, e.g. require a unique minion-target interaction to be followed by both resource deltas and a minion-entity disappearance or target switch."}}
{"run":29,"commit":"62b07f8","metric":6321,"metrics":{},"status":"keep","description":"Extended kill attribution to dominant multi-recipient reward windows, crediting the top post-death resource recipient only when its immediate reward total is at least 2× the runner-up.","timestamp":1776525885565,"segment":2,"confidence":3.5521739130434784,"iterationTokens":16666,"asi":{"hypothesis":"Some real kills have more than one post-death reward recipient; when one recipient’s immediate 0x3e/0x4d reward is clearly dominant, that player is likely the killer while the smaller recipients are assist/team-share noise.","learning":"This substantially expanded kill coverage: kill_players rose from 15 to 25 and replay_players from 33 to 35. Spot checks look plausible, though a few one-sided matches now show very high carry kill counts and should be re-validated against additional signals before treating the heuristic as final ground truth.","artifact":"detect_kill_like_interactions() now falls back from direct combat interactions to either a unique reward recipient or a dominant reward recipient (>=2x the next post-death recipient within 0.5s).","next_action_hint":"Tighten or validate the dominant-reward kill heuristic against another independent signal—e.g. recent hero-target 1087 presence, victim damage spikes, or killer-side 0x4d appearance—before pushing further on CS/item/assist decoding."}}
{"run":30,"commit":"ac1d338","metric":6367,"metrics":{},"status":"keep","description":"Added a conservative 0x42-only fallback for players with no detected 0x3e level-ups, recovering a few extra plausible level milestones without changing kill or resource logic.","timestamp":1776526152263,"segment":2,"confidence":3.6260504201680672,"iterationTokens":13089,"asi":{"hypothesis":"A small subset of players seem to expose level-jump stat bursts around 1086 family 0x42 even when 0x3e never triggers the existing detector; limiting 0x42 to players with zero prior level detections should recover edge cases without broadly inflating level counts.","learning":"This added 2 more level_players (23 -> 25) and 7 extra level-up events, with spot-checked outputs still looking plausible in affected ARAL matches. The gain is modest but clean.","artifact":"detect_level_like_milestones() now accepts 0x42 as a fallback trigger only for players that still have no prior detected level-up events.","next_action_hint":"The biggest open gap is still CS quality, not coverage. To improve further, look for a dedicated minion/last-hit counter or a stronger last-hit signature around rewarded minion-target interactions instead of pushing kill heuristics harder."}}
{"run":31,"commit":"22ffa65","metric":6647,"metrics":{},"status":"keep","description":"Decoded match winner from the late 1077 post-match burst, added winner display to the dashboard, and promoted winner_matches into the benchmark.","timestamp":1776527227871,"segment":2,"confidence":4.517786561264822,"iterationTokens":5436,"asi":{"hypothesis":"Complete matches emit a structured post-game transition burst; if the repeated 1077 target marks a losing-side player, the opposite team can be exposed as the winner and added to the dashboard safely.","learning":"The end-burst heuristic generalized across all 7 full benchmark matches. In the long example matches, it consistently marks Team Blue as winner, which also fits the broader decoded scoreboard context.","artifact":"MatchState now carries winning_team / losing_team / winner_focus_entity_id; vg_match_dashboard.py prints Winner in the header; vg_dashboard_server.py exposes winner fields; evaluator now tracks winner_matches and rewards it in scoreboard_score.","next_action_hint":"Validate the winner rule against any additional captures or UI evidence if available, then return to CS quality—the main remaining weak gameplay field for replay-grade scoreboard states."}}
{"run":32,"commit":"22ffa65","metric":6567,"metrics":{},"status":"discard","description":"Tried restricting winner detection to 1077 bursts whose team word is explicitly 1/2, to avoid earlier non-postgame 1077 groups.","timestamp":1776527319402,"segment":2,"confidence":4.646341463414634,"iterationTokens":5300,"asi":{"hypothesis":"Only the clean final 1077 burst with team word 1/2 should count as a winner signal; ignoring noisier 1077 groups might reduce overfitting.","rollback_reason":"Too strict. winner_matches dropped from 7 to 5, which suggests at least two full matches only expose the winner through a less-clean variant of the same end-burst pattern.","learning":"Earlier 1077 groups do exist mid-match, but the current broader detector still generalized better on the benchmark corpus than the stricter final-team-word gate.","next_action_hint":"Keep the existing broader winner heuristic and, if we want extra safety later, validate it with another independent end-of-match marker such as nearby 1165/1009/1060 rather than filtering only on the 1077 team word."}}
