{"run":33,"commit":"cce942c","metric":6647,"metrics":{},"status":"keep","description":"Fixed winner polarity: the late 1077 end burst targets a winning-side focus player, not the losing side, so the example long matches now correctly show Team Red as winner.","timestamp":1776528422547,"segment":2,"confidence":4.171532846715328,"iterationTokens":76816,"asi":{"hypothesis":"The earlier winner heuristic had the 1077 polarity reversed; user feedback plus end-of-match map positions suggested the burst target belongs to the winning side, not the loser.","learning":"Flipping the polarity preserved winner coverage (winner_matches stayed 7) while fixing the user-flagged counterexample `20260403_150848_ff8a37e1` and also making `20260404_192117_8454884c` decode as Team Red, which better fits the late-match state.","artifact":"detect_match_winner() and vg_dashboard_server.py now derive winner from the burst target player's team; `winner_matches` only measures presence, so the benchmark score stayed flat even though polarity correctness improved.","next_action_hint":"Find a stronger post-game packet than 1077—most likely inside opcode 1165—to validate winner independently and eventually score winner correctness, not just winner presence."}}
{"run":34,"commit":"cce942c","metric":6669,"metrics":{},"status":"discard","description":"Tried shortening CS farm-window dedupe from 3.0s to 2.0s and deduping per player instead of per target. It improved the benchmark, but it inflated short-match CS too aggressively (e.g. 83 CS in a 4:03 ARAL sample), so it looks like overcounted farm activity rather than trustworthy last-hits.","timestamp":1776529653596,"segment":2,"confidence":4.082142857142857,"iterationTokens":76816,"asi":{"hypothesis":"The current CS heuristic undercounts because 1087 farm targets 2000/2008 are reused channel-like ids, so a shorter per-player dedupe window might recover missed last-hits.","rollback_reason":"Primary score improved, but the CS totals became qualitatively implausible in short matches, which is worse than the current conservative undercount for a replay-grade scoreboard decoder.","learning":"The farm signal is dense and real, but 1087->1086 bursts occur roughly every 0.5-0.6s for active farmers. That means the signal tracks sustained minion farm activity, not one-to-one last-hits, so simply lowering the time gate overcounts badly.","evidence":"`20260403_213752_b98d3255` jumped from 56 to 83 CS in 4:03; several other farmers crossed into 80-100+ CS ranges with only modest match durations.","next_action_hint":"Keep the conservative 3.0s gate for now and look for an additional discriminator inside farm bursts—delta-size patterns, burst structure, or a separate snapshot/end-state field—before changing CS totals again."}}
{"run":35,"commit":"5e5c8d1","metric":6667,"metrics":{},"status":"keep","description":"Widened the fallback 0x42 level-up lookahead to 0.35s / 80 messages while still using it only for players with zero prior detected levels. This recovered one new level player and two plausible total level milestones without inflating CS or winner logic.","timestamp":1776529990550,"segment":2,"confidence":6.121052631578947,"iterationTokens":17152,"asi":{"hypothesis":"Some real level-up followup stat changes arrive slightly later for fallback 0x42 pulses than for the main 0x3e pulses, so a slightly wider 0x42-only window should recover missed level milestones conservatively.","learning":"A small 0x42-only window increase is useful: it recovered a plausible first level-up for Thorn in `20260403_213752_b98d3255` and an extra milestone for Fasoot in `20260403_192414_8033dd36`. Broader changes were much riskier, but this narrow fallback-only tweak stayed controlled.","artifact":"level_players rose from 25 to 26 and total_level_ups from 67 to 69 while scoreboard_score improved to 6667 and all other key metrics stayed flat.","next_action_hint":"Look for similarly conservative completeness gains in level or kill attribution before returning to CS; the CS farm-burst signal needs an extra discriminator, not a looser time gate."}}
{"run":36,"commit":"b40a49a","metric":6797,"metrics":{},"status":"keep","description":"Widened the main 0x3e level-up stat-followup window to 0.30s / 80 messages, kept the 0x42 fallback at 0.35s / 80 messages, and capped ARAL level-ups at 8 so detected levels cannot exceed 12. This recovered several plausible missed levels and improved replay-ready players.","timestamp":1776530238436,"segment":2,"confidence":6.465,"iterationTokens":11814,"asi":{"hypothesis":"Some real level-up followup stat changes for the main 0x3e channel arrive slightly later than the old 0.25s / 60-message window, so widening it should recover missed milestones as long as ARAL max-level limits prevent runaway overcounts.","learning":"The broader 0x3e window is useful when paired with a hard ARAL cap. It recovered believable extra levels for players like ArcLinux, JustFvckedMyHoe, Jatagan, XoXLblCoCytXui, Ardan, and Guset, while the cap blocked the otherwise-impossible level-13 case on Polat1071.","artifact":"scoreboard_score rose to 6797, level_players to 29, replay_players to 38, and total_level_ups to 80 with no change to kills, deaths, CS, winner coverage, gold, or XP coverage.","next_action_hint":"With levels much healthier now, the next likely wins are either a conservative kill-attribution completeness bump or a direct snapshot-derived scoreboard field that can improve CS without loosening the noisy farm-burst heuristic."}}
{"run":37,"commit":"99c5622","metric":6804,"metrics":{},"status":"keep","description":"Restricted kill attribution to opposing-team candidates only. This removed friendly-fire artifacts from post-death reward windows and slightly improved the benchmark even though kill_players dropped.","timestamp":1776530612011,"segment":2,"confidence":6.718346253229974,"iterationTokens":18195,"asi":{"hypothesis":"Some current kill attributions are wrong because reward-window fallbacks credit allied post-death recipients; filtering candidates to the opposing team should improve semantic correctness and may still preserve or improve useful coverage.","learning":"There were many same-team kill assignments in the old heuristic. Opponent-only filtering eliminated them entirely, redistributed kills more plausibly, raised total_kills from 98 to 100, and improved replay_players from 38 to 39 even though kill_players fell from 25 to 23.","artifact":"Kill attribution no longer allows teammate killers when team data is known. The benchmark improved to 6804 with same gold/xp/death/CS/level coverage and zero friendly-fire kill artifacts.","next_action_hint":"Test whether extending the opponent-only reward window from 0.5s to 1.0s can safely recover additional kill attributions, since exploratory analysis suggested more unique post-death opponent rewards without reintroducing same-team errors."}}
{"run":38,"commit":"7fd789e","metric":6855,"metrics":{},"status":"keep","description":"Extended the opponent-only post-death reward fallback window from 0.5s to 1.0s. This recovered extra kill attributions from clean unique opponent reward recipients while keeping same-team killer artifacts at zero.","timestamp":1776530689584,"segment":2,"confidence":8.605095541401274,"iterationTokens":3194,"asi":{"hypothesis":"Once teammate recipients are excluded, a longer post-death reward window should safely capture delayed kill rewards that the 0.5s cutoff misses.","learning":"The extra 0.5s helps: several deaths had no 0.5s opponent reward pattern but did have a clean unique opponent reward recipient within 1.0s. With the opponent-only filter in place, widening the window improved kill coverage without reviving friendly-fire artifacts.","artifact":"scoreboard_score rose to 6855, kill_players to 26, and total_kills to 105 while same-team kill assignments remained zero.","next_action_hint":"Audit the new 1.0s kill attributions on the two user-important long matches, then either keep tuning kill quality or return to finding a direct CS/snapshot field now that levels and kills are materially stronger."}}
{"run":39,"commit":"7fd789e","metric":6873,"metrics":{},"status":"discard","description":"Tried lowering the opponent-only dominant-reward kill threshold from 2x to 1.5x. It benchmarked higher, but manual audit showed it was pulling in ambiguous multi-recipient fights rather than clearly cleaner kills.","timestamp":1776530957735,"segment":2,"confidence":7.402739726027397,"iterationTokens":16795,"asi":{"hypothesis":"After removing teammate candidates and widening the reward window, a 1.5x dominant-opponent reward might still be safe enough to recover extra kills.","rollback_reason":"The extra kills came from ambiguous multi-recipient reward windows, especially in clustered fight sequences, so the higher score looked like over-attribution rather than a trustworthy scoreboard improvement.","learning":"Opponent-only filtering fixed the major semantic bug, but 1.5x dominance is still too loose. Cases like `20260403_192414_8033dd36` and `20260404_195459_2becf48d` started admitting crowded reward distributions and near-duplicate deaths that are not clean enough for replay-grade kill totals.","evidence":"Benchmark jumped to total_kills=115, but added attributions included many `dom1.5` cases with multiple opposing recipients and relatively close totals (e.g. 64 vs 36 vs 33, or 147 vs 85) rather than unique or clearly dominant winners.","next_action_hint":"Keep the 2x dominance rule. If more kill coverage is needed, search for another corroborating signal instead of weakening the reward-margin threshold."}}
{"run":40,"commit":"9652b8a","metric":6873,"metrics":{},"status":"keep","description":"Added a conservative second-pass ARAL level fallback: zero-level players with very high XP (>=12000) now get one extra level-like milestone only if a nearby 0x42 pulse is followed by exactly one stat-type change. This fixed a couple of obviously undercounted base-level players without touching CS or kills.","timestamp":1776534566517,"segment":2,"confidence":6.581730769230769,"iterationTokens":58422,"asi":{"hypothesis":"A few long ARAL players still stuck at base level 4 are missing their first detected level because the normal detector wants 2 stat-type changes; a zero-level-only 0x42 fallback with a single nearby stat change can recover those cases without reopening broad level inflation.","learning":"The narrow fallback is useful and controlled. It only added two players (`Temporary skyandsoul` and `hacked`), both of whom had very high XP and were implausible at level 4 for the full match duration.","artifact":"scoreboard_score rose to 6873, level_players to 30, and total_level_ups to 81 while kills, deaths, CS, gold, XP, and winner coverage stayed unchanged.","next_action_hint":"Return to CS with the new gameplay constraint: broad equal team-wide reward pulses are ambient/periodic gold noise, so the next viable CS gain probably needs a burst-shape filter plus an additional corroborating signal, not just a shorter dedupe window."}}
{"run":41,"commit":"7af82c7","metric":6911,"metrics":{},"status":"keep","description":"Lowered the conservative ARAL zero-level fallback threshold from 12000 XP to 10000 XP. That recovered one more plausible missed level (`Temporary Natora`) while keeping the fallback limited to zero-level players with a temporal 0x42 + single-stat-change pattern.","timestamp":1776534646656,"segment":2,"confidence":6.797101449275362,"iterationTokens":28061,"asi":{"hypothesis":"The zero-level 0x42 fallback is still too conservative at 12000 XP; lowering it slightly to 10000 XP may recover a few more obviously undercounted ARAL players without broadening the heuristic much.","learning":"The lower cutoff only added one more believable player in the current corpus (`Temporary Natora` at 5:36 with 10011 XP), so the fallback remains narrow and temporal rather than turning into a static XP-to-level guess.","artifact":"scoreboard_score rose to 6911, level_players to 31, replay_players to 40, and total_level_ups to 82 while kills, deaths, CS, gold, XP, and winner coverage stayed unchanged.","next_action_hint":"Revisit CS with the user-provided ambient-gold rule, but keep rejecting heuristic changes that inflate short-match CS; the next CS gain likely needs a direct summary/snapshot field or a stricter last-hit corroboration signal."}}
{"run":42,"commit":"d6bfb3d","metric":6929,"metrics":{},"status":"keep","description":"Lowered the conservative ARAL zero-level fallback threshold from 10000 XP to 9000 XP. This recovered one more plausible missed level (`TRK`) while still requiring a temporal 0x42 pulse plus exactly one nearby stat-type change.","timestamp":1776534704925,"segment":2,"confidence":6.91747572815534,"iterationTokens":2336,"asi":{"hypothesis":"The zero-level ARAL fallback can likely be lowered a bit further without getting noisy, because players around 9000+ XP in these short ARAL matches are still unlikely to have stayed at base level 4 if a temporal 0x42+stat signal exists.","learning":"Dropping the cutoff to 9000 XP only added one more believable player (`TRK` in the 3:02 ARAL sample), so the fallback remains selective rather than turning into a blanket XP-based level guess.","artifact":"scoreboard_score rose to 6929, level_players to 32, and total_level_ups to 83 while replay_players stayed at 40 and all non-level metrics stayed flat.","next_action_hint":"Pause on levels unless a similarly narrow temporal fallback appears; the next real frontier is still CS, ideally via a direct summary/snapshot field or a stricter last-hit corroboration signal that respects the ambient-gold rule."}}
{"run":43,"commit":"c0f114f","metric":6929,"metrics":{"scored_matches":7,"winner_matches":7,"total_players":42,"gold_players":42,"xp_players":42,"death_timeline_players":41,"death_players":30,"kill_players":26,"cs_players":18,"level_players":32,"replay_players":40,"useful_parse_score":497,"position_players":41,"ability_trigger_players":16,"minion_interaction_players":18,"item_players":2,"talent_choice_players":41,"world_position_entities":780,"total_kills":105,"total_deaths":176,"total_cs":361,"total_level_ups":83},"status":"keep","description":"Added user-requested secondary useful-parse coverage metrics without changing the primary scoreboard objective. The evaluator now reports broader semantic coverage like player positions, ability-like triggers, minion interactions, item/talent signals, and tracked non-player world-position entities.","timestamp":1776583660138,"segment":2,"confidence":6.951219512195122,"iterationTokens":38897,"asi":{"hypothesis":"We can expose broader useful semantic coverage as secondary diagnostics without changing the scoreboard-focused primary metric, so the benchmark stays aligned to replay scoreboard quality while also showing progress on things like positions and ability-like triggers.","learning":"The repo already has meaningful broader semantic signals: 41 active players with positions, 16 with ability-like trigger signals, 18 with minion interaction signals, 41 with talent-choice signals, 2 with item-like signals, and 780 tracked non-player world-position entities across scored matches. We still cannot honestly call those non-player positions 'minion positions' yet.","artifact":"`scripts/evaluate_decode_coverage.py` now emits `useful_parse_score`, `position_players`, `ability_trigger_players`, `minion_interaction_players`, `item_players`, `talent_choice_players`, and `world_position_entities`. `vg_match_dashboard.py` now tracks non-player/world position entities from opcode 1070.","next_action_hint":"Use these new diagnostics to steer future work: minion positions are still unresolved, ability-like triggers are partial but measurable, and CS still needs either a direct field or a stronger last-hit corroboration signal."}}
{"run":44,"commit":"08bb247","metric":6967,"metrics":{"scored_matches":7,"winner_matches":7,"total_players":42,"gold_players":42,"xp_players":42,"death_timeline_players":41,"death_players":30,"kill_players":26,"cs_players":18,"level_players":33,"replay_players":41,"useful_parse_score":497,"position_players":41,"ability_trigger_players":16,"minion_interaction_players":18,"item_players":2,"talent_choice_players":41,"world_position_entities":780,"total_kills":105,"total_deaths":176,"total_cs":361,"total_level_ups":84},"status":"keep","description":"Lowered the conservative ARAL zero-level fallback threshold from 9000 XP to 7000 XP. This recovered one more plausible missed level (`atta`) and raised replay-ready players again, while keeping the fallback limited to zero-level players with a temporal 0x42 pulse plus exactly one nearby stat-type change.","timestamp":1776590989186,"segment":2,"confidence":7.171568627450981,"iterationTokens":2459,"asi":{"hypothesis":"The zero-level ARAL fallback can safely go a bit lower than 9000 XP because it still requires a temporal 0x42 pulse and exactly one nearby stat-type change, so only a handful of clearly undercounted players should qualify.","learning":"Dropping the cutoff to 7000 XP only added one more believable player (`atta` in the 3:02 ARAL sample). It did not widen into a generic XP-to-level mapping, and it improved replay-ready rows from 40 to 41.","artifact":"scoreboard_score rose to 6967, level_players to 33, replay_players to 41, and total_level_ups to 84 while CS, kills, deaths, winner coverage, and useful-parse diagnostics stayed unchanged.","next_action_hint":"Pause level tuning unless another equally narrow temporal fallback appears. The next substantial win is still likely in CS or direct end-summary/snapshot field decoding."}}
{"run":45,"commit":"f3da36a","metric":7003,"metrics":{"scored_matches":7,"winner_matches":7,"total_players":42,"gold_players":42,"xp_players":42,"death_timeline_players":41,"death_players":30,"kill_players":26,"cs_players":18,"level_players":35,"replay_players":41,"useful_parse_score":497,"position_players":41,"ability_trigger_players":16,"minion_interaction_players":18,"item_players":2,"talent_choice_players":41,"world_position_entities":780,"total_kills":105,"total_deaths":176,"total_cs":361,"total_level_ups":86},"status":"keep","description":"Extended the conservative ARAL zero-level fallback to also accept single-stat 0x3e windows, recovering two more plausible missed level-5 milestones for high-XP players who otherwise stayed stuck at base level 4.","timestamp":1776591900289,"segment":2,"confidence":8.715116279069768,"iterationTokens":2459,"asi":{"hypothesis":"Some remaining zero-level ARAL players are missing levels not because 0x42 is special, but because their best level-adjacent pulse is a 0x3e update followed by exactly one stat change; allowing that only in the narrow zero-level fallback should recover obviously undercounted players without broadening the main detector.","learning":"This added two plausible fallback level-5 detections (`hacked` and `dumbfvckglory`) and improved level_players from 33 to 35 while keeping kills, CS, gold, XP, winner coverage, and useful-parse diagnostics flat.","artifact":"The new fallback-triggered events were 0x3e windows at 138.77s for `hacked` and 144.22s for `dumbfvckglory`, each with exactly one nearby stat-type change.","next_action_hint":"Pause level tuning again unless another comparably narrow temporal fallback appears. The next meaningful gain is still more likely to come from CS or a direct summary/snapshot scoreboard field than from broader level heuristics."}}
{"run":46,"commit":"fa32d13","metric":7032,"metrics":{"scored_matches":7,"winner_matches":7,"total_players":42,"gold_players":42,"xp_players":42,"death_timeline_players":41,"death_players":30,"kill_players":27,"cs_players":18,"level_players":35,"replay_players":41,"useful_parse_score":497,"position_players":41,"ability_trigger_players":16,"minion_interaction_players":18,"item_players":2,"talent_choice_players":41,"world_position_entities":780,"total_kills":110,"total_deaths":176,"total_cs":361,"total_level_ups":86},"status":"keep","description":"Added a conservative kill-attribution fallback that uses a unique opponent-only 0x42 reward pulse after the existing combat and 0x3e/0x4d reward logic fail, recovering five plausible missed kills without reintroducing same-team artifacts.","timestamp":1776593409121,"segment":2,"confidence":10.186666666666667,"iterationTokens":116319,"asi":{"hypothesis":"Some unattributed deaths still expose a clean killer-side reward signal in 1086 type 0x42 even when the existing 0x3e/0x4d reward fallback stays empty. Using 0x42 only as a second-pass unique opponent-only fallback should recover real kills without broadening into noisy dominant-window guesses.","learning":"This recovered five additional kills across four matches and raised kill_players from 26 to 27 with zero same-team killer artifacts. The new kills were spread onto previously under-attributed players (`TBAPb`, `Fasoot`, `1o1`, `buijjjj`, `SERGEY_KH`) rather than inflating the existing top fraggers.","artifact":"New kill events came from unique 0x42 post-death reward windows on `Temporary skyandsoul`, `MAOSADAO`, `Playerone`, and two `SHANKS` deaths after the prior direct/0x3e/0x4d logic found nothing.","next_action_hint":"If we revisit kill attribution again, the next promising lead is 0x40 post-death reward pulses—but only with an extra corroboration signal. For now, avoid broader reward-family fallbacks that would overfit ambient death-window noise."}}
