{"type":"config","name":"Full Vainglory match protocol decoding","metricName":"decode_score","metricUnit":"","bestDirection":"higher"}
{"run":1,"commit":"8b83c33","metric":2872,"metrics":{"full_players":0,"hero_players":0,"event_kinds":1,"matches_with_mode":9,"total_players":48},"status":"keep","description":"Baseline semantic decode coverage benchmark over all captured matches using current decoder capabilities.","timestamp":1776518904930,"segment":0,"confidence":null,"iterationTokens":88,"asi":{"hypothesis":"Establish a stable baseline metric for semantic decode coverage before exploring new opcode/field decoders.","baseline_observations":"Game mode is decoded for all benchmarked matches, but no player hero assignments are recovered and no fully populated player records exist yet.","bottleneck":"Most decrypted traffic still lacks semantic labeling beyond roster, positions, and a few stat/property streams.","next_action_hint":"Investigate high-frequency opcodes around roster/setup and scoreboard-related payloads to recover hero mapping and richer player-state fields."}}
{"run":2,"commit":"8b83c33","metric":2956,"metrics":{"full_players":0,"hero_players":0,"event_kinds":3,"matches_with_mode":9,"total_players":48},"status":"keep","description":"Added heuristic opcode 1067 state decoding to surface death/respawn state transitions alongside existing damage spikes.","timestamp":1776519297284,"segment":0,"confidence":null,"iterationTokens":45383,"asi":{"hypothesis":"Opcode 1067 contains player state transitions; treating idx=0 state=3/1 as death/respawn should surface additional semantic event categories.","learning":"The heuristic increased distinct event categories from 1 to 3 across the capture corpus, indicating opcode 1067 carries repeatable lifecycle information.","confidence_note":"This is still heuristic labeling, not a confirmed semantic mapping, but it is stable enough to be useful as a decoding lead.","next_action_hint":"Investigate opcode 1011 and snapshot/roster cross-links to recover hero assignments or richer per-player state."}}
{"run":3,"commit":"8b83c33","metric":3196,"metrics":{"full_players":0,"hero_players":0,"event_kinds":3,"matches_with_mode":9,"total_players":54},"status":"keep","description":"Treated opcode 1113 as an earlier snapshot variant, recovering roster records from short/pre-match captures that previously decoded as zero players.","timestamp":1776519369510,"segment":0,"confidence":3.857142857142857,"iterationTokens":5765,"asi":{"hypothesis":"Opcode 1113 reuses the 1114-style roster record layout and can bootstrap player rows when the capture ends before normal 1114 snapshots appear.","learning":"Decoding 1113 with the snapshot parser recovered the missing six-player roster in the short HF_Ranked capture, increasing corpus player coverage from 48 to 54 rows.","artifact":"1113 records use the same key offsets for handle/entity/team/UUID as 1114 in the short capture examined.","next_action_hint":"Look for other near-snapshot opcodes or per-player setup messages that can populate heroes or complete player records."}}
{"run":4,"commit":"8b83c33","metric":3868,"metrics":{"full_players":0,"hero_players":0,"spawn_players":42,"event_kinds":3,"matches_with_mode":9,"total_players":54},"status":"keep","description":"Decoded opcode 1011 into per-player spawn/setup fields, recovering stable hero-type IDs, spawn coordinates, and spawn health values for full-match captures.","timestamp":1776519740863,"segment":0,"confidence":6.148148148148148,"iterationTokens":13717,"asi":{"hypothesis":"Opcode 1011 is a per-player spawn/setup blob; decoding stable fields from it should materially increase semantic coverage even before hero-name mapping is solved.","learning":"1011 cleanly links to roster entries by entity ID and yields stable hero_type_id plus spawn position/health fields for 42 player rows across the corpus.","artifact":"Useful offsets: 0:4 hero_type_id candidate, 10:12 entity_id, 12:16 team, 16:24 spawn XY, 112:120 spawn health pair.","next_action_hint":"Cluster hero_type_id values across matches and correlate them with other setup opcodes or external hero stat signatures to map hero_type_id -> hero name."}}
{"run":5,"commit":"8b83c33","metric":3910,"metrics":{"full_players":0,"hero_players":0,"spawn_players":42,"event_kinds":3,"matches_with_mode":9,"total_players":54},"status":"keep","description":"Corrected opcode 1011 field alignment: spawn coordinates live at byte offsets 18/22 and spawn health at 138/142, improving decoded setup-field coverage.","timestamp":1776519900361,"segment":0,"confidence":3.2037037037037037,"iterationTokens":8581,"asi":{"hypothesis":"Several 1011 fields were misaligned by 2 bytes; correcting those offsets should turn placeholder setup fields into plausible coordinates and health values.","learning":"1011 uses mixed alignment: entity/team fields are aligned, but key float fields are shifted by 2 bytes. The corrected offsets produce plausible spawn XY and health values.","artifact":"Confirmed useful 1011 offsets now: 0:4 hero_type_id, 8:12 entity_id word, 12:16 team, 18:22 spawn X, 22:26 spawn Y, 138:142 spawn health, 142:146 spawn health max.","next_action_hint":"Use corrected spawn stats plus hero_type_id clustering to fingerprint heroes, or attack 1052/1087 as likely sources for persistent hero stats and inventory-like state."}}
{"run":6,"commit":"8b83c33","metric":4246,"metrics":{"full_players":0,"hero_players":0,"spawn_players":42,"scalar_players":42,"event_kinds":3,"matches_with_mode":9,"total_players":54},"status":"keep","description":"Decoded opcode 1052 as a typed per-entity scalar stream, capturing stable scalar stat slots for all full-match hero records.","timestamp":1776519960873,"segment":0,"confidence":2.880503144654088,"iterationTokens":2730,"asi":{"hypothesis":"Opcode 1052 is not just noise; it is a typed scalar-stat stream keyed by entity ID, and preserving those typed values increases semantic state coverage.","learning":"1052 reliably attaches to hero entities and exposes repeatable scalar slots (at least two per player in full matches), even if the exact semantics of each scalar type are still open.","artifact":"Current 1052 parse: entity_id at 2:4, scalar_value at 8:12, scalar_type at byte 12.","next_action_hint":"Name the common 1052 scalar types by correlating them with hero archetype, spawn health, movement, or known Vainglory stat ranges; then attack 1087 for inventory-like state."}}
{"run":7,"commit":"8b83c33","metric":4582,"metrics":{"full_players":0,"hero_players":0,"spawn_players":42,"scalar_players":42,"extended_players":42,"event_kinds":3,"matches_with_mode":9,"total_players":54},"status":"keep","description":"Decoded opcode 1087 as a typed extended-property stream, preserving per-player u16 property codes and latest values/aux data for full-match hero records.","timestamp":1776520076071,"segment":0,"confidence":2.544642857142857,"iterationTokens":3825,"asi":{"hypothesis":"Opcode 1087 is another structured per-entity state stream; retaining its typed property codes should expand player-state coverage beyond the simpler 1052/1086 channels.","learning":"1087 reliably attaches to hero entities and yields a dense set of repeatable property codes per player, likely including inventory/stateful gameplay fields.","artifact":"Current 1087 parse: entity_id at 2:4, prop_code at 12:14, prop_value at 14:16, aux_value at 28:32.","next_action_hint":"Cluster frequent 1087 prop codes by hero_type_id and over time to separate persistent loadout fields from counters/items, then try naming the stable families."}}
{"run":8,"commit":"8b83c33","metric":4930,"metrics":{"full_players":0,"hero_players":0,"spawn_players":54,"profile_players":54,"scalar_players":42,"extended_players":42,"event_kinds":3,"matches_with_mode":9,"total_players":54},"status":"keep","description":"Recovered hero-type and stable profile identifiers directly from snapshot records, extending hero-linked setup coverage to all 54 decoded player rows including short/incomplete captures.","timestamp":1776520642566,"segment":0,"confidence":2.9696969696969697,"iterationTokens":4970,"asi":{"hypothesis":"Snapshot records themselves carry hero-linked identifiers; if rec[16:18] mirrors hero_type_id and rec[20:24] is a stable per-player profile field, short captures can gain the same setup coverage as full matches.","learning":"rec[16:18] in 1113/1114 snapshots matches the 1011 hero_type_id candidate, and rec[20:24] is a stable nonzero profile identifier. This extends hero-type coverage from 42 to all 54 player rows.","artifact":"1113/1114 snapshot fields now treated as: rec[16:18] hero_type_id, rec[20:24] snapshot_profile_id.","next_action_hint":"Use timeline diffs over snapshot profile/hero-type anchored players to infer level/item/ability counters, especially under ARAL starting-level constraints."}}
{"run":9,"commit":"8b83c33","metric":5196,"metrics":{"full_players":0,"hero_players":0,"spawn_players":54,"profile_players":54,"active_players":53,"scalar_players":42,"extended_players":42,"event_kinds":4,"matches_with_mode":9,"total_players":54},"status":"keep","description":"Decoded snapshot activity flags and surfaced first-activation timeline events, separating players who actually become active from roster entries in incomplete or never-started captures.","timestamp":1776520833622,"segment":0,"confidence":3.2549019607843137,"iterationTokens":8692,"asi":{"hypothesis":"Snapshot bytes 9/10 are activity/readiness flags; using them should distinguish roster placeholders from players who actually enter the timeline and improve handling of incomplete captures.","learning":"rec[9] and rec[10] transition from 0 to 1 when a player becomes active in 1113/1114 snapshots. This yields meaningful 'became active' timeline events and explains incomplete-match edge cases.","artifact":"Snapshot active flag heuristic: active when rec[9] == 1 and rec[10] == 1.","next_action_hint":"Use active-player anchored timelines to search for level/item/ability counters whose deltas start only after activation, especially in ARAL captures with level-4 starts."}}
{"run":10,"commit":"8b83c33","metric":5448,"metrics":{"full_players":0,"hero_players":0,"spawn_players":54,"profile_players":54,"active_players":53,"prop_counter_players":42,"scalar_players":42,"extended_players":42,"event_kinds":4,"matches_with_mode":9,"total_players":54},"status":"keep","description":"Generalized opcode 1086 into a typed counter/property map while preserving the existing gold/xp aliases, expanding timeline state coverage for full-match hero records.","timestamp":1776520996427,"segment":0,"confidence":2.9711649365628605,"iterationTokens":26126,"asi":{"hypothesis":"Opcode 1086 carries more than just the two known gold/xp channels; retaining all typed counters should expose additional progression signals for later naming.","learning":"1086 is a broader typed counter stream. The known 0x3e/0x4d aliases remain useful, but storing all property types gives a denser per-player progression timeline for full matches.","artifact":"Player.prop_counters now captures latest counter by opcode-1086 property type, alongside existing gold_counter/xp_counter aliases.","next_action_hint":"Correlate 1086 type families with activation time, ARAL start-level expectations, and 1052/1087 changes to isolate level, XP, and inventory-adjacent fields."}}
{"type":"config","name":"Full Vainglory match protocol decoding","metricName":"decode_score","metricUnit":"","bestDirection":"higher"}
{"run":11,"commit":"8b83c33","metric":5566,"metrics":{"full_players":41,"hero_players":0,"spawn_players":54,"profile_players":54,"active_players":53,"prop_counter_players":42,"scalar_players":42,"extended_players":42,"event_kinds":4,"matches_with_mode":9,"total_players":54},"status":"keep","description":"Rebased the benchmark after re-validating assumptions: reward typed timeline coverage and structural player completeness, not overconfident gold/xp or unstable 1087 sequence fields.","timestamp":1776521576918,"segment":1,"confidence":null,"iterationTokens":137,"asi":{"hypothesis":"The benchmark had started rewarding potentially incorrect semantic assumptions; resetting it around typed timeline coverage should better match the real decoding goal.","learning":"1087 needed a safer family/target interpretation and 1086 gold/xp aliases remain tentative. Structural completeness plus typed timeline coverage is a more trustworthy optimization target for now.","rollback_reason":"","next_action_hint":"Probe post-death counter pulses and other timeline-correlated updates to separate kill rewards, item effects, and ability/cooldown-related fields under the corrected baseline."}}
{"run":12,"commit":"8b83c33","metric":5608,"metrics":{"full_players":41,"hero_players":0,"spawn_players":54,"profile_players":54,"active_players":53,"prop_counter_players":42,"scalar_players":42,"extended_players":42,"event_kinds":5,"matches_with_mode":9,"total_players":54},"status":"keep","description":"Added post-death counter-pulse detection, surfacing a new reward-like timeline category when multiple players receive synchronized opcode-1086 updates right after a death.","timestamp":1776521649930,"segment":1,"confidence":null,"iterationTokens":3018,"asi":{"hypothesis":"Kills/deaths should cause correlated counter changes; scanning immediately after death states for synchronized 1086 updates can surface reward windows before exact gold/xp attribution is solved.","learning":"Several matches show repeatable post-death counter pulses, most often in opcode-1086 family types like 0x40/0x3e/0x4d, indicating kill-adjacent reward/state updates are present and detectable.","artifact":"New helper detect_post_death_counter_pulses() emits neutral reward-like events without overclaiming exact semantics.","next_action_hint":"Differentiate which post-death pulse families represent killer gold, team XP, bounty, or respawn-side state by comparing affected player sets and delta magnitudes."}}
{"run":13,"commit":"8b83c33","metric":5808,"metrics":{"full_players":41,"hero_players":0,"spawn_players":54,"profile_players":54,"active_players":53,"prop_counter_players":42,"interaction_players":25,"scalar_players":42,"extended_players":42,"event_kinds":5,"matches_with_mode":9,"total_players":54},"status":"keep","description":"Split opcode-1087 state into self-targeted extended properties versus off-target interaction properties, exposing a clearer separation between local state and combat/objective-like interactions.","timestamp":1776521761790,"segment":1,"confidence":5.761904761904762,"iterationTokens":5035,"asi":{"hypothesis":"1087 mixes self-state and target-directed updates; separating self-targeted versus off-target messages should better align the stream with items/cooldowns versus combat/minion interactions.","learning":"A substantial subset of players show off-target 1087 interactions once self-target noise is removed, which is promising for combat, minion, or objective semantics.","artifact":"Player.interaction_props now holds 1087 entries where target_id != source entity, while self-targeted entries stay in Player.extended_props.","next_action_hint":"Cluster interaction_props by target class (hero vs non-hero like 2000/2008) and family byte to separate combat, minion last-hit, and item/talent side effects."}}
{"run":14,"commit":"8b83c33","metric":5850,"metrics":{"full_players":41,"hero_players":0,"spawn_players":54,"profile_players":54,"active_players":53,"prop_counter_players":42,"interaction_players":25,"scalar_players":42,"extended_players":42,"event_kinds":6,"matches_with_mode":9,"total_players":54},"status":"keep","description":"Added first-seen minion-like interaction events for opcode-1087 target-directed updates into the 2000-2099 entity range, surfacing a new farm/objective-adjacent timeline category.","timestamp":1776521950661,"segment":1,"confidence":2.347107438016529,"iterationTokens":8891,"asi":{"hypothesis":"Off-target 1087 updates into the 2000-2099 entity range are likely lane/minion interactions; surfacing them as tentative timeline events should expose farm/objective-adjacent structure without overcommitting exact semantics.","learning":"The 2000-2099 target band is common enough to form a distinct interaction class, and exposing it adds a stable new event category across the corpus.","artifact":"New detect_interaction_timeline_events() helper emits tentative 'minion-like interaction' events from 1087 non-self target updates.","next_action_hint":"Break the 2000-2099 target band down further and compare counter deltas around these minion-like events to isolate last-hit gold/xp versus generic lane-state updates."}}
{"run":15,"commit":"fc26402","metric":5886,"metrics":{"full_players":41,"hero_players":0,"spawn_players":54,"profile_players":54,"active_players":53,"prop_counter_players":42,"interaction_players":25,"scalar_players":42,"extended_players":42,"event_kinds":7,"matches_with_mode":9,"total_players":54},"status":"keep","description":"Added first-seen hero-target 1087 interaction events as tentative ability-like combat signals, giving the timeline a distinct cast/combat-adjacent category.","timestamp":1776522010353,"segment":1,"confidence":4.102564102564102,"iterationTokens":2476,"asi":{"hypothesis":"Off-target 1087 updates aimed at other hero entities are likely combat or ability-side interactions; surfacing them as tentative hero-target events should expose another meaningful timeline category.","learning":"Hero-target 1087 interactions are common enough to form a stable separate event class from minion-like interactions, which supports the idea that 1087 mixes combat-side signaling with local state.","artifact":"detect_interaction_timeline_events() now emits 'ability-like hero interaction' events for first-seen hero-target 1087 updates and 'minion-like interaction' events for 2000-2099 targets.","next_action_hint":"Correlate hero-target interaction families with nearby 1053 damage pulses and state changes to distinguish ability casts from generic attacks or status effects."}}
{"run":16,"commit":"724c104","metric":5916,"metrics":{"full_players":41,"hero_players":0,"spawn_players":54,"profile_players":54,"active_players":53,"prop_counter_players":42,"interaction_players":25,"scalar_players":42,"extended_players":42,"event_kinds":8,"matches_with_mode":9,"total_players":54},"status":"keep","description":"Correlated hero-target 1087 interactions with nearby target death states to surface tentative kill-like combat events in the match timeline.","timestamp":1776522093301,"segment":1,"confidence":4.861111111111111,"iterationTokens":3716,"asi":{"hypothesis":"If 1087 hero-target interactions are combat-side signals, some should cluster immediately before target death states and can be surfaced as kill-like windows.","learning":"A subset of hero-target 1087 interactions consistently precede target death states within ~1s, which is strong evidence that this stream carries combat-resolution information rather than only passive state.","artifact":"New detect_kill_like_interactions() helper emits tentative kill-like events when hero-target 1087 updates are followed by a target death transition.","next_action_hint":"Use kill-like windows to compare which 1086/1052 families change on killer, victim, and teammates, then isolate actual gold/xp/bounty counters and maybe assist signals."}}
{"run":17,"commit":"13b907c","metric":5922,"metrics":{"full_players":41,"hero_players":0,"spawn_players":54,"profile_players":54,"active_players":53,"prop_counter_players":42,"interaction_players":25,"scalar_players":42,"extended_players":42,"event_kinds":9,"matches_with_mode":9,"total_players":54},"status":"keep","description":"Added assist-like death-window detection by looking for multiple distinct hero-target 1087 interaction sources before a target dies.","timestamp":1776522144483,"segment":1,"confidence":5.393939393939394,"iterationTokens":2632,"asi":{"hypothesis":"If multiple heroes emit target-directed 1087 interactions into the same victim shortly before a death, that window is a good assist-like candidate even before exact scoreboard fields are found.","learning":"Multi-attacker death windows do exist in the corpus and can be surfaced separately from single-source kill-like windows, giving the timeline a tentative assist category.","artifact":"New detect_assist_like_interactions() helper emits assist-like events when 2+ distinct sources target the same victim within 1s before death.","next_action_hint":"Use assist-like and kill-like windows to identify which 1086/1052 families increase on the killer only versus all nearby attackers, then promote the most consistent ones into tentative bounty/xp/item-side annotations."}}
